/*
 * Licensed to the Apache Software Foundation (ASF) under one
 * or more contributor license agreements.  See the NOTICE file
 * distributed with this work for additional information
 * regarding copyright ownership.  The ASF licenses this file
 * to you under the Apache License, Version 2.0 (the
 * "License"); you may not use this file except in compliance
 * with the License.  You may obtain a copy of the License at
 *
 * http://www.apache.org/licenses/LICENSE-2.0
 *
 * Unless required by applicable law or agreed to in writing,
 * software distributed under the License is distributed on an
 * "AS IS" BASIS, WITHOUT WARRANTIES OR CONDITIONS OF ANY
 * KIND, either express or implied.  See the License for the
 * specific language governing permissions and limitations
 * under the License.
 */
LOAD 'age';
SET search_path TO ag_catalog;
--
-- delete_specific_GRAPH_global_contexts
--
--
SELECT * FROM create_graph('ag_graph_1');
NOTICE:  graph "ag_graph_1" has been created
 create_graph 
--------------
 
(1 row)

SELECT * FROM cypher('ag_graph_1', $$ CREATE (v:vertex1) RETURN v  $$) AS (v agtype);
                                   v                                   
-----------------------------------------------------------------------
 {"id": 844424930131969, "label": "vertex1", "properties": {}}::vertex
(1 row)

SELECT * FROM create_graph('ag_graph_2');
NOTICE:  graph "ag_graph_2" has been created
 create_graph 
--------------
 
(1 row)

SELECT * FROM cypher('ag_graph_2', $$ CREATE (v:vertex2) RETURN v  $$) AS (v agtype);
                                   v                                   
-----------------------------------------------------------------------
 {"id": 844424930131969, "label": "vertex2", "properties": {}}::vertex
(1 row)

SELECT * FROM create_graph('ag_graph_3');
NOTICE:  graph "ag_graph_3" has been created
 create_graph 
--------------
 
(1 row)

SELECT * FROM cypher('ag_graph_3', $$ CREATE (v:vertex3) RETURN v  $$) AS (v agtype);
                                   v                                   
-----------------------------------------------------------------------
 {"id": 844424930131969, "label": "vertex3", "properties": {}}::vertex
(1 row)

-- load contexts using the vertex_stats command
-- Build all three graph contexts under one snapshot. The vertex_stats()
-- calls are wrapped in a single REPEATABLE READ transaction so they share
-- one snapshot; this keeps the snapshot-fallback path in is_ggctx_invalid()
-- from purging an already-built context when concurrent xid activity
-- (autovacuum, parallel installcheck, replication) advances the snapshot
-- between calls. Read Committed is insufficient: it takes a fresh snapshot
-- per statement.
BEGIN ISOLATION LEVEL REPEATABLE READ;
SELECT * FROM cypher('ag_graph_3', $$ MATCH (u) RETURN vertex_stats(u) ORDER BY id(u) $$) AS (result agtype);
                                            result                                             
-----------------------------------------------------------------------------------------------
 {"id": 844424930131969, "label": "vertex3", "in_degree": 0, "out_degree": 0, "self_loops": 0}
(1 row)

SELECT * FROM cypher('ag_graph_2', $$ MATCH (u) RETURN vertex_stats(u) ORDER BY id(u) $$) AS (result agtype);
                                            result                                             
-----------------------------------------------------------------------------------------------
 {"id": 844424930131969, "label": "vertex2", "in_degree": 0, "out_degree": 0, "self_loops": 0}
(1 row)

SELECT * FROM cypher('ag_graph_1', $$ MATCH (u) RETURN vertex_stats(u) ORDER BY id(u) $$) AS (result agtype);
                                            result                                             
-----------------------------------------------------------------------------------------------
 {"id": 844424930131969, "label": "vertex1", "in_degree": 0, "out_degree": 0, "self_loops": 0}
(1 row)

COMMIT;
--- loading undefined contexts
--- should throw exception - graph "ag_graph_4" does not exist
SELECT * FROM cypher('ag_graph_4', $$ MATCH (u) RETURN vertex_stats(u) ORDER BY id(u) $$) AS (result agtype);
ERROR:  graph "ag_graph_4" does not exist
LINE 1: SELECT * FROM cypher('ag_graph_4', $$ MATCH (u) RETURN verte...
                             ^
--- delete with invalid parameter
---should return false
SELECT * FROM cypher('ag_graph_2', $$ RETURN delete_global_graphs('E1337') $$) AS (result agtype);
 result 
--------
 false
(1 row)

-- delete ag_graph_2's context
-- should return true
SELECT * FROM cypher('ag_graph_2', $$ RETURN delete_global_graphs('ag_graph_2') $$) AS (result agtype);
 result 
--------
 true
(1 row)

-- delete ag_graph_1's context
-- should return true(succeed) because the previous command should not delete the 1st graph's context
SELECT * FROM cypher('ag_graph_1', $$ RETURN delete_global_graphs('ag_graph_1') $$) AS (result agtype);
 result 
--------
 true
(1 row)

-- delete ag_graph_3's context
-- should return true(succeed) because the previous commands should not delete the 3rd graph's context
SELECT * FROM cypher('ag_graph_3', $$ RETURN delete_global_graphs('ag_graph_3') $$) AS (result agtype);
 result 
--------
 true
(1 row)

-- delete all graphs' context again
-- should return false (did not succeed) for all of them because they are already removed
SELECT * FROM cypher('ag_graph_2', $$ RETURN delete_global_graphs('ag_graph_2') $$) AS (result agtype);
 result 
--------
 false
(1 row)

SELECT * FROM cypher('ag_graph_1', $$ RETURN delete_global_graphs('ag_graph_1') $$) AS (result agtype);
 result 
--------
 false
(1 row)

SELECT * FROM cypher('ag_graph_3', $$ RETURN delete_global_graphs('ag_graph_3') $$) AS (result agtype);
 result 
--------
 false
(1 row)

--- delete uninitialized graph context
--- should throw exception graph "ag_graph_4" does not exist
SELECT * FROM cypher('ag_graph_4', $$ RETURN delete_global_graphs('ag_graph_4') $$) AS (result agtype);
ERROR:  graph "ag_graph_4" does not exist
LINE 1: SELECT * FROM cypher('ag_graph_4', $$ RETURN delete_global_g...
                             ^
--
-- delete_GRAPH_global_contexts
--
-- load contexts again
-- Same REPEATABLE READ wrap as the first build phase above, for the same
-- snapshot-stability reason.
BEGIN ISOLATION LEVEL REPEATABLE READ;
SELECT * FROM cypher('ag_graph_3', $$ MATCH (u) RETURN vertex_stats(u) ORDER BY id(u) $$) AS (result agtype);
                                            result                                             
-----------------------------------------------------------------------------------------------
 {"id": 844424930131969, "label": "vertex3", "in_degree": 0, "out_degree": 0, "self_loops": 0}
(1 row)

SELECT * FROM cypher('ag_graph_2', $$ MATCH (u) RETURN vertex_stats(u) ORDER BY id(u) $$) AS (result agtype);
                                            result                                             
-----------------------------------------------------------------------------------------------
 {"id": 844424930131969, "label": "vertex2", "in_degree": 0, "out_degree": 0, "self_loops": 0}
(1 row)

SELECT * FROM cypher('ag_graph_1', $$ MATCH (u) RETURN vertex_stats(u) ORDER BY id(u) $$) AS (result agtype);
                                            result                                             
-----------------------------------------------------------------------------------------------
 {"id": 844424930131969, "label": "vertex1", "in_degree": 0, "out_degree": 0, "self_loops": 0}
(1 row)

COMMIT;
-- delete all graph contexts
-- should return true
SELECT * FROM cypher('ag_graph_1', $$ RETURN delete_global_graphs(NULL) $$) AS (result agtype);
 result 
--------
 true
(1 row)

-- delete all graphs' context individually
-- should return false for all of them because already removed
SELECT * FROM cypher('ag_graph_1', $$ RETURN delete_global_graphs('ag_graph_1') $$) AS (result agtype);
 result 
--------
 false
(1 row)

SELECT * FROM cypher('ag_graph_2', $$ RETURN delete_global_graphs('ag_graph_2') $$) AS (result agtype);
 result 
--------
 false
(1 row)

SELECT * FROM cypher('ag_graph_3', $$ RETURN delete_global_graphs('ag_graph_3') $$) AS (result agtype);
 result 
--------
 false
(1 row)

--
-- age_vertex_stats
--
--checking validity of vertex_stats
--adding unlabelled vertices to ag_graph_1
SELECT * FROM cypher('ag_graph_1', $$ CREATE (n), (m) $$) as (v agtype);
 v 
---
(0 rows)

--adding labelled vertice to graph 2
SELECT * FROM cypher('ag_graph_2', $$ CREATE (:Person) $$) as (v agtype);
 v 
---
(0 rows)

---adding edges between nodes
SELECT * FROM cypher('ag_graph_2', $$ MATCH (a:Person), (b:Person) WHERE a.name = 'A' AND b.name = 'B' CREATE (a)-[e:RELTYPE]->(b) RETURN e ORDER BY id(e) $$) as (e agtype);
 e 
---
(0 rows)

--checking if vertex stats have been updated along with the new label
--should return 3 vertices
SELECT * FROM cypher('ag_graph_1', $$ MATCH (n) RETURN vertex_stats(n) ORDER BY id(n) $$) AS (result agtype);
                                            result                                             
-----------------------------------------------------------------------------------------------
 {"id": 281474976710657, "label": "", "in_degree": 0, "out_degree": 0, "self_loops": 0}
 {"id": 281474976710658, "label": "", "in_degree": 0, "out_degree": 0, "self_loops": 0}
 {"id": 844424930131969, "label": "vertex1", "in_degree": 0, "out_degree": 0, "self_loops": 0}
(3 rows)

--should return 1 vertice and 1 label
SELECT * FROM cypher('ag_graph_2', $$ MATCH (a) RETURN vertex_stats(a) ORDER BY id(a) $$) AS (result agtype);
                                            result                                             
-----------------------------------------------------------------------------------------------
 {"id": 844424930131969, "label": "vertex2", "in_degree": 0, "out_degree": 0, "self_loops": 0}
 {"id": 1125899906842625, "label": "Person", "in_degree": 0, "out_degree": 0, "self_loops": 0}
(2 rows)

--
-- graph_stats command
--
-- what's in the current graphs?
SELECT * FROM cypher('ag_graph_1', $$ RETURN graph_stats('ag_graph_1') $$) AS (result agtype);
                                  result                                  
--------------------------------------------------------------------------
 {"graph": "ag_graph_1", "num_loaded_edges": 0, "num_loaded_vertices": 3}
(1 row)

SELECT * FROM cypher('ag_graph_1', $$ RETURN graph_stats('ag_graph_2') $$) AS (result agtype);
                                  result                                  
--------------------------------------------------------------------------
 {"graph": "ag_graph_2", "num_loaded_edges": 0, "num_loaded_vertices": 2}
(1 row)

SELECT * FROM cypher('ag_graph_1', $$ RETURN graph_stats('ag_graph_3') $$) AS (result agtype);
                                  result                                  
--------------------------------------------------------------------------
 {"graph": "ag_graph_3", "num_loaded_edges": 0, "num_loaded_vertices": 1}
(1 row)

-- add some edges
SELECT * FROM cypher('ag_graph_1', $$ CREATE ()-[:knows]->() $$) AS (results agtype);
 results 
---------
(0 rows)

SELECT * FROM cypher('ag_graph_1', $$ CREATE ()-[:knows]->() $$) AS (results agtype);
 results 
---------
(0 rows)

SELECT * FROM cypher('ag_graph_1', $$ CREATE ()-[:knows]->() $$) AS (results agtype);
 results 
---------
(0 rows)

SELECT * FROM cypher('ag_graph_1', $$ CREATE ()-[:knows]->() $$) AS (results agtype);
 results 
---------
(0 rows)

-- what is there now?
SELECT * FROM cypher('ag_graph_1', $$ RETURN graph_stats('ag_graph_1') $$) AS (result agtype);
                                  result                                   
---------------------------------------------------------------------------
 {"graph": "ag_graph_1", "num_loaded_edges": 4, "num_loaded_vertices": 11}
(1 row)

-- add some more
SELECT * FROM cypher('ag_graph_1', $$ MATCH (u)-[]->(v) SET u.id = id(u)
                                                        SET v.id = id(v)
                                                        SET u.name = 'u'
                                                        SET v.name = 'v'
                                      RETURN u,v ORDER BY id(u), id(v) $$) AS (u agtype, v agtype);
                                                u                                                 |                                                v                                                 
--------------------------------------------------------------------------------------------------+--------------------------------------------------------------------------------------------------
 {"id": 281474976710659, "label": "", "properties": {"id": 281474976710659, "name": "u"}}::vertex | {"id": 281474976710660, "label": "", "properties": {"id": 281474976710660, "name": "v"}}::vertex
 {"id": 281474976710661, "label": "", "properties": {"id": 281474976710661, "name": "u"}}::vertex | {"id": 281474976710662, "label": "", "properties": {"id": 281474976710662, "name": "v"}}::vertex
 {"id": 281474976710663, "label": "", "properties": {"id": 281474976710663, "name": "u"}}::vertex | {"id": 281474976710664, "label": "", "properties": {"id": 281474976710664, "name": "v"}}::vertex
 {"id": 281474976710665, "label": "", "properties": {"id": 281474976710665, "name": "u"}}::vertex | {"id": 281474976710666, "label": "", "properties": {"id": 281474976710666, "name": "v"}}::vertex
(4 rows)

SELECT * FROM cypher('ag_graph_1', $$ MATCH (u)-[]->(v) MERGE (v)-[:stalks]->(u) $$) AS (result agtype);
 result 
--------
(0 rows)

SELECT * FROM cypher('ag_graph_1', $$ MATCH (u)-[e]->(v) RETURN u, e, v ORDER BY id(e) $$) AS (u agtype, e agtype, v agtype);
                                                u                                                 |                                                              e                                                              |                                                v                                                 
--------------------------------------------------------------------------------------------------+-----------------------------------------------------------------------------------------------------------------------------+--------------------------------------------------------------------------------------------------
 {"id": 281474976710659, "label": "", "properties": {"id": 281474976710659, "name": "u"}}::vertex | {"id": 1125899906842625, "label": "knows", "end_id": 281474976710660, "start_id": 281474976710659, "properties": {}}::edge  | {"id": 281474976710660, "label": "", "properties": {"id": 281474976710660, "name": "v"}}::vertex
 {"id": 281474976710661, "label": "", "properties": {"id": 281474976710661, "name": "u"}}::vertex | {"id": 1125899906842626, "label": "knows", "end_id": 281474976710662, "start_id": 281474976710661, "properties": {}}::edge  | {"id": 281474976710662, "label": "", "properties": {"id": 281474976710662, "name": "v"}}::vertex
 {"id": 281474976710663, "label": "", "properties": {"id": 281474976710663, "name": "u"}}::vertex | {"id": 1125899906842627, "label": "knows", "end_id": 281474976710664, "start_id": 281474976710663, "properties": {}}::edge  | {"id": 281474976710664, "label": "", "properties": {"id": 281474976710664, "name": "v"}}::vertex
 {"id": 281474976710665, "label": "", "properties": {"id": 281474976710665, "name": "u"}}::vertex | {"id": 1125899906842628, "label": "knows", "end_id": 281474976710666, "start_id": 281474976710665, "properties": {}}::edge  | {"id": 281474976710666, "label": "", "properties": {"id": 281474976710666, "name": "v"}}::vertex
 {"id": 281474976710660, "label": "", "properties": {"id": 281474976710660, "name": "v"}}::vertex | {"id": 1407374883553281, "label": "stalks", "end_id": 281474976710659, "start_id": 281474976710660, "properties": {}}::edge | {"id": 281474976710659, "label": "", "properties": {"id": 281474976710659, "name": "u"}}::vertex
 {"id": 281474976710662, "label": "", "properties": {"id": 281474976710662, "name": "v"}}::vertex | {"id": 1407374883553282, "label": "stalks", "end_id": 281474976710661, "start_id": 281474976710662, "properties": {}}::edge | {"id": 281474976710661, "label": "", "properties": {"id": 281474976710661, "name": "u"}}::vertex
 {"id": 281474976710664, "label": "", "properties": {"id": 281474976710664, "name": "v"}}::vertex | {"id": 1407374883553283, "label": "stalks", "end_id": 281474976710663, "start_id": 281474976710664, "properties": {}}::edge | {"id": 281474976710663, "label": "", "properties": {"id": 281474976710663, "name": "u"}}::vertex
 {"id": 281474976710666, "label": "", "properties": {"id": 281474976710666, "name": "v"}}::vertex | {"id": 1407374883553284, "label": "stalks", "end_id": 281474976710665, "start_id": 281474976710666, "properties": {}}::edge | {"id": 281474976710665, "label": "", "properties": {"id": 281474976710665, "name": "u"}}::vertex
(8 rows)

-- what is there now?
SELECT * FROM cypher('ag_graph_1', $$ RETURN graph_stats('ag_graph_1') $$) AS (result agtype);
                                  result                                   
---------------------------------------------------------------------------
 {"graph": "ag_graph_1", "num_loaded_edges": 8, "num_loaded_vertices": 11}
(1 row)

-- remove some vertices
SELECT * FROM ag_graph_1._ag_label_vertex ORDER BY id;
       id        |              properties              
-----------------+--------------------------------------
 281474976710657 | {}
 281474976710658 | {}
 281474976710659 | {"id": 281474976710659, "name": "u"}
 281474976710660 | {"id": 281474976710660, "name": "v"}
 281474976710661 | {"id": 281474976710661, "name": "u"}
 281474976710662 | {"id": 281474976710662, "name": "v"}
 281474976710663 | {"id": 281474976710663, "name": "u"}
 281474976710664 | {"id": 281474976710664, "name": "v"}
 281474976710665 | {"id": 281474976710665, "name": "u"}
 281474976710666 | {"id": 281474976710666, "name": "v"}
 844424930131969 | {}
(11 rows)

DELETE FROM ag_graph_1._ag_label_vertex WHERE id::text = '281474976710661';
DELETE FROM ag_graph_1._ag_label_vertex WHERE id::text = '281474976710662';
DELETE FROM ag_graph_1._ag_label_vertex WHERE id::text = '281474976710664';
SELECT * FROM ag_graph_1._ag_label_vertex ORDER BY id;
       id        |              properties              
-----------------+--------------------------------------
 281474976710657 | {}
 281474976710658 | {}
 281474976710659 | {"id": 281474976710659, "name": "u"}
 281474976710660 | {"id": 281474976710660, "name": "v"}
 281474976710663 | {"id": 281474976710663, "name": "u"}
 281474976710665 | {"id": 281474976710665, "name": "u"}
 281474976710666 | {"id": 281474976710666, "name": "v"}
 844424930131969 | {}
(8 rows)

SELECT * FROM ag_graph_1._ag_label_edge ORDER BY id;
        id        |    start_id     |     end_id      | properties 
------------------+-----------------+-----------------+------------
 1125899906842625 | 281474976710659 | 281474976710660 | {}
 1125899906842626 | 281474976710661 | 281474976710662 | {}
 1125899906842627 | 281474976710663 | 281474976710664 | {}
 1125899906842628 | 281474976710665 | 281474976710666 | {}
 1407374883553281 | 281474976710660 | 281474976710659 | {}
 1407374883553282 | 281474976710662 | 281474976710661 | {}
 1407374883553283 | 281474976710664 | 281474976710663 | {}
 1407374883553284 | 281474976710666 | 281474976710665 | {}
(8 rows)

-- The graph_stats query below will produce warnings for the dangling edges
-- created by the DELETE commands above. The warnings appear in nondeterministic
-- order because they come from iterating edge label tables (knows, stalks),
-- so we suppress them with client_min_messages. Without suppression, the
-- output would include these warnings (in some order):
--
-- WARNING:  edge: [id: 1125899906842626, start: 281474976710661, end: 281474976710662, label: knows] start and end vertices not found
-- WARNING:  ignored malformed or dangling edge
-- WARNING:  edge: [id: 1125899906842627, start: 281474976710663, end: 281474976710664, label: knows] end vertex not found
-- WARNING:  ignored malformed or dangling edge
-- WARNING:  edge: [id: 1407374883553282, start: 281474976710662, end: 281474976710661, label: stalks] start and end vertices not found
-- WARNING:  ignored malformed or dangling edge
-- WARNING:  edge: [id: 1407374883553283, start: 281474976710664, end: 281474976710663, label: stalks] start vertex not found
-- WARNING:  ignored malformed or dangling edge
--
-- The result row validates that graph_stats handled the dangling edges correctly.
SET client_min_messages = error;
SELECT * FROM cypher('ag_graph_1', $$ RETURN graph_stats('ag_graph_1') $$) AS (result agtype);
                                  result                                  
--------------------------------------------------------------------------
 {"graph": "ag_graph_1", "num_loaded_edges": 8, "num_loaded_vertices": 8}
(1 row)

RESET client_min_messages;
--drop graphs
SELECT * FROM drop_graph('ag_graph_1', true);
NOTICE:  drop cascades to 5 other objects
DETAIL:  drop cascades to table ag_graph_1._ag_label_vertex
drop cascades to table ag_graph_1._ag_label_edge
drop cascades to table ag_graph_1.vertex1
drop cascades to table ag_graph_1.knows
drop cascades to table ag_graph_1.stalks
NOTICE:  graph "ag_graph_1" has been dropped
 drop_graph 
------------
 
(1 row)

SELECT * FROM drop_graph('ag_graph_2', true);
NOTICE:  drop cascades to 5 other objects
DETAIL:  drop cascades to table ag_graph_2._ag_label_vertex
drop cascades to table ag_graph_2._ag_label_edge
drop cascades to table ag_graph_2.vertex2
drop cascades to table ag_graph_2."Person"
drop cascades to table ag_graph_2."RELTYPE"
NOTICE:  graph "ag_graph_2" has been dropped
 drop_graph 
------------
 
(1 row)

SELECT * FROM drop_graph('ag_graph_3', true);
NOTICE:  drop cascades to 3 other objects
DETAIL:  drop cascades to table ag_graph_3._ag_label_vertex
drop cascades to table ag_graph_3._ag_label_edge
drop cascades to table ag_graph_3.vertex3
NOTICE:  graph "ag_graph_3" has been dropped
 drop_graph 
------------
 
(1 row)

-----------------------------------------------------------------------------------------------------------------------------
--
-- VLE cache invalidation tests
--
-- These tests verify that the graph version counter properly invalidates
-- the VLE hash table cache when the graph is mutated, and that thin
-- entry lazy property fetch returns correct data.
--
-- Setup: create a graph with a chain a->b->c->d
SELECT * FROM create_graph('vle_cache_test');
NOTICE:  graph "vle_cache_test" has been created
 create_graph 
--------------
 
(1 row)

SELECT * FROM cypher('vle_cache_test', $$
  CREATE (a:Node {name: 'a'})-[:Edge]->(b:Node {name: 'b'})-[:Edge]->(c:Node {name: 'c'})-[:Edge]->(d:Node {name: 'd'})
$$) AS (v agtype);
 v 
---
(0 rows)

-- VLE query: find all paths from a's neighbors (should find b, b->c, b->c->d)
SELECT * FROM cypher('vle_cache_test', $$
  MATCH (a:Node {name: 'a'})-[:Edge*1..3]->(n:Node)
  RETURN n.name
  ORDER BY n.name
$$) AS (name agtype);
 name 
------
 "b"
 "c"
 "d"
(3 rows)

-- Now add a new node e connected to d. This should invalidate the cache.
SELECT * FROM cypher('vle_cache_test', $$
  MATCH (d:Node {name: 'd'})
  CREATE (d)-[:Edge]->(:Node {name: 'e'})
$$) AS (v agtype);
 v 
---
(0 rows)

-- VLE query again: should now also find e via a->b->c->d->e (4 hops won't reach,
-- but d->e is 1 hop from d, and a->b->c->d->e would be 4 hops from a).
-- Increase range to *1..4 to include e
SELECT * FROM cypher('vle_cache_test', $$
  MATCH (a:Node {name: 'a'})-[:Edge*1..4]->(n:Node)
  RETURN n.name
  ORDER BY n.name
$$) AS (name agtype);
 name 
------
 "b"
 "c"
 "d"
 "e"
(4 rows)

-- Test cache invalidation on DELETE: remove node c and its edges
SELECT * FROM cypher('vle_cache_test', $$
  MATCH (c:Node {name: 'c'})
  DETACH DELETE c
$$) AS (v agtype);
 v 
---
(0 rows)

-- VLE query: should only find b now (c is gone, so b->c path is broken)
SELECT * FROM cypher('vle_cache_test', $$
  MATCH (a:Node {name: 'a'})-[:Edge*1..4]->(n:Node)
  RETURN n.name
  ORDER BY n.name
$$) AS (name agtype);
 name 
------
 "b"
(1 row)

-- Test cache invalidation on SET: change b's name property
SELECT * FROM cypher('vle_cache_test', $$
  MATCH (b:Node {name: 'b'})
  SET b.name = 'b_modified'
  RETURN b.name
$$) AS (name agtype);
     name     
--------------
 "b_modified"
(1 row)

-- VLE query: verify the updated property is returned via lazy fetch
SELECT * FROM cypher('vle_cache_test', $$
  MATCH (a:Node {name: 'a'})-[:Edge*1..4]->(n:Node)
  RETURN n.name
  ORDER BY n.name
$$) AS (name agtype);
     name     
--------------
 "b_modified"
(1 row)

-- Test VLE with edge properties (exercises thin entry edge property fetch)
SELECT * FROM drop_graph('vle_cache_test', true);
NOTICE:  drop cascades to 4 other objects
DETAIL:  drop cascades to table vle_cache_test._ag_label_vertex
drop cascades to table vle_cache_test._ag_label_edge
drop cascades to table vle_cache_test."Node"
drop cascades to table vle_cache_test."Edge"
NOTICE:  graph "vle_cache_test" has been dropped
 drop_graph 
------------
 
(1 row)

SELECT * FROM create_graph('vle_cache_test2');
NOTICE:  graph "vle_cache_test2" has been created
 create_graph 
--------------
 
(1 row)

SELECT * FROM cypher('vle_cache_test2', $$
  CREATE (a:N {name: 'a'})-[:E {weight: 1}]->(b:N {name: 'b'})-[:E {weight: 2}]->(c:N {name: 'c'})
$$) AS (v agtype);
 v 
---
(0 rows)

-- VLE path output to verify edge properties are fetched correctly via
-- thin entry lazy fetch. Returning the full path forces build_path()
-- to call get_edge_entry_properties() for each edge in the result.
-- The output must contain the correct weight values (1 and 2).
SELECT * FROM cypher('vle_cache_test2', $$
  MATCH p=(a:N {name: 'a'})-[:E *1..2]->(n:N)
  RETURN p
  ORDER BY n.name
$$) AS (p agtype);
                                                                                                                                                                                                                                                        p                                                                                                                                                                                                                                                         
------------------------------------------------------------------------------------------------------------------------------------------------------------------------------------------------------------------------------------------------------------------------------------------------------------------------------------------------------------------------------------------------------------------------------------------------------------------------------------------------------------------
 [{"id": 844424930131969, "label": "N", "properties": {"name": "a"}}::vertex, {"id": 1125899906842626, "label": "E", "end_id": 844424930131970, "start_id": 844424930131969, "properties": {"weight": 1}}::edge, {"id": 844424930131970, "label": "N", "properties": {"name": "b"}}::vertex]::path
 [{"id": 844424930131969, "label": "N", "properties": {"name": "a"}}::vertex, {"id": 1125899906842626, "label": "E", "end_id": 844424930131970, "start_id": 844424930131969, "properties": {"weight": 1}}::edge, {"id": 844424930131970, "label": "N", "properties": {"name": "b"}}::vertex, {"id": 1125899906842625, "label": "E", "end_id": 844424930131971, "start_id": 844424930131970, "properties": {"weight": 2}}::edge, {"id": 844424930131971, "label": "N", "properties": {"name": "c"}}::vertex]::path
(2 rows)

-- VLE edge properties via UNWIND + relationships() to individually verify
-- each edge's properties are correctly fetched from the heap via TID.
SELECT * FROM cypher('vle_cache_test2', $$
  MATCH p=(a:N {name: 'a'})-[:E *1..2]->(n:N)
  WITH p, n
  UNWIND relationships(p) AS e
  RETURN n.name, e.weight
  ORDER BY n.name, e.weight
$$) AS (name agtype, weight agtype);
 name | weight 
------+--------
 "b"  | 1
 "c"  | 1
 "c"  | 2
(3 rows)

-- Cleanup
SELECT * FROM drop_graph('vle_cache_test2', true);
NOTICE:  drop cascades to 4 other objects
DETAIL:  drop cascades to table vle_cache_test2._ag_label_vertex
drop cascades to table vle_cache_test2._ag_label_edge
drop cascades to table vle_cache_test2."N"
drop cascades to table vle_cache_test2."E"
NOTICE:  graph "vle_cache_test2" has been dropped
 drop_graph 
------------
 
(1 row)

-----------------------------------------------------------------------------------------------------------------------------
--
-- VLE cache invalidation via direct SQL (trigger tests)
--
-- These tests verify that the SQL trigger (age_invalidate_graph_cache)
-- properly invalidates the VLE cache when label tables are mutated
-- via direct SQL INSERT, UPDATE, DELETE, and TRUNCATE — not via Cypher.
--
-- Setup: create graph with a chain a->b->c using Cypher
SELECT * FROM create_graph('vle_trigger_test');
NOTICE:  graph "vle_trigger_test" has been created
 create_graph 
--------------
 
(1 row)

SELECT * FROM cypher('vle_trigger_test', $$
  CREATE (a:Node {name: 'a'})-[:Edge]->(b:Node {name: 'b'})-[:Edge]->(c:Node {name: 'c'})
$$) AS (v agtype);
 v 
---
(0 rows)

-- Prime the VLE cache: find all nodes reachable from a
SELECT * FROM cypher('vle_trigger_test', $$
  MATCH (a:Node {name: 'a'})-[:Edge*1..3]->(n:Node)
  RETURN n.name
  ORDER BY n.name
$$) AS (name agtype);
 name 
------
 "b"
 "c"
(2 rows)

-- Direct SQL INSERT on vertex: add a new vertex via SQL.
-- This should fire the trigger and invalidate the VLE cache.
-- Use _graphid() with the label's id and nextval for the entry id.
INSERT INTO vle_trigger_test."Node" (id, properties)
SELECT ag_catalog._graphid(l.id,
           nextval('vle_trigger_test."Node_id_seq"'::regclass)),
       '{"name": "d"}'::agtype
FROM ag_catalog.ag_label l
JOIN ag_catalog.ag_graph g ON g.graphid = l.graph
WHERE g.name = 'vle_trigger_test' AND l.name = 'Node';
-- VLE query: results should be unchanged (d has no edges) but cache was rebuilt
SELECT * FROM cypher('vle_trigger_test', $$
  MATCH (a:Node {name: 'a'})-[:Edge*1..3]->(n:Node)
  RETURN n.name
  ORDER BY n.name
$$) AS (name agtype);
 name 
------
 "b"
 "c"
(2 rows)

-- Direct SQL UPDATE on vertex: change b's name to 'b_updated'
-- This should fire the trigger and invalidate the VLE cache.
UPDATE vle_trigger_test."Node"
SET properties = '{"name": "b_updated"}'::agtype
WHERE properties @> '{"name": "b"}'::agtype;
-- VLE query: verify updated property is visible (cache invalidated by trigger)
SELECT * FROM cypher('vle_trigger_test', $$
  MATCH (a:Node {name: 'a'})-[:Edge*1..3]->(n:Node)
  RETURN n.name
  ORDER BY n.name
$$) AS (name agtype);
    name     
-------------
 "b_updated"
 "c"
(2 rows)

-- Direct SQL DELETE on edge: remove the edge from b_updated to c
DELETE FROM vle_trigger_test."Edge"
WHERE end_id = (SELECT id FROM vle_trigger_test."Node"
                WHERE properties @> '{"name": "c"}'::agtype);
-- VLE query: only b_updated reachable now (edge to c is gone)
SELECT * FROM cypher('vle_trigger_test', $$
  MATCH (a:Node {name: 'a'})-[:Edge*1..3]->(n:Node)
  RETURN n.name
  ORDER BY n.name
$$) AS (name agtype);
    name     
-------------
 "b_updated"
(1 row)

-- Direct SQL TRUNCATE on edge table: remove all edges
TRUNCATE vle_trigger_test."Edge";
-- VLE query: no edges exist, should return no rows
SELECT * FROM cypher('vle_trigger_test', $$
  MATCH (a:Node {name: 'a'})-[:Edge*1..3]->(n:Node)
  RETURN n.name
  ORDER BY n.name
$$) AS (name agtype);
 name 
------
(0 rows)

-- Cleanup
SELECT * FROM drop_graph('vle_trigger_test', true);
NOTICE:  drop cascades to 4 other objects
DETAIL:  drop cascades to table vle_trigger_test._ag_label_vertex
drop cascades to table vle_trigger_test._ag_label_edge
drop cascades to table vle_trigger_test."Node"
drop cascades to table vle_trigger_test."Edge"
NOTICE:  graph "vle_trigger_test" has been dropped
 drop_graph 
------------
 
(1 row)

-----------------------------------------------------------------------------------------------------------------------------
--
-- Heap rewrites must invalidate cached graph contexts
--
-- A rewrite moves every TID a cached context holds and announces itself through
-- no trigger and no version counter. Left untracked, the context keeps
-- resolving stale TIDs against the new file: it reads the wrong tuple, or a
-- block past the end of a now shorter relation.
--
-- Every rewrite below is preceded by a read that caches the context and
-- followed by a read in the SAME session; a fresh session would rebuild and
-- prove nothing. The low ids are deleted first so the survivors sit at high
-- offsets and a rewrite has to move them. Ground truth throughout is the
-- 59 -> 60 path.
--
-----------------------------------------------------------------------------------------------------------------------------
SELECT create_graph('rewrite_inval');
NOTICE:  graph "rewrite_inval" has been created
 create_graph 
--------------
 
(1 row)

SELECT * FROM cypher('rewrite_inval', $$
    UNWIND range(1, 60) AS i CREATE ({id: i})
$$) AS (v agtype);
 v 
---
(0 rows)

SELECT * FROM cypher('rewrite_inval', $$
    MATCH (a), (b) WHERE a.id = 59 AND b.id = 60 CREATE (a)-[:R]->(b)
$$) AS (v agtype);
 v 
---
(0 rows)

SELECT * FROM cypher('rewrite_inval', $$
    MATCH (n) WHERE n.id < 51 DETACH DELETE n
$$) AS (v agtype);
 v 
---
(0 rows)

SELECT * FROM cypher('rewrite_inval', $$
    MATCH p = (n0)-[:R*..2]->(n1) RETURN p
$$) AS (p agtype);
                                                                                                                                                       p                                                                                                                                                       
---------------------------------------------------------------------------------------------------------------------------------------------------------------------------------------------------------------------------------------------------------------------------------------------------------------
 [{"id": 281474976710715, "label": "_ag_label_vertex", "properties": {"id": 59}}::vertex, {"id": 844424930131969, "label": "R", "end_id": 281474976710716, "start_id": 281474976710715, "properties": {}}::edge, {"id": 281474976710716, "label": "_ag_label_vertex", "properties": {"id": 60}}::vertex]::path
(1 row)

-- CLUSTER rewrites in index order, moving the survivors to the front
CLUSTER rewrite_inval."_ag_label_vertex" USING "_ag_label_vertex_pkey";
SELECT * FROM cypher('rewrite_inval', $$
    MATCH p = (n0)-[:R*..2]->(n1) RETURN p
$$) AS (p agtype);
                                                                                                                                                       p                                                                                                                                                       
---------------------------------------------------------------------------------------------------------------------------------------------------------------------------------------------------------------------------------------------------------------------------------------------------------------
 [{"id": 281474976710715, "label": "_ag_label_vertex", "properties": {"id": 59}}::vertex, {"id": 844424930131969, "label": "R", "end_id": 281474976710716, "start_id": 281474976710715, "properties": {}}::edge, {"id": 281474976710716, "label": "_ag_label_vertex", "properties": {"id": 60}}::vertex]::path
(1 row)

-- make dead space again so VACUUM FULL has something to compact away
SELECT * FROM cypher('rewrite_inval', $$
    UNWIND range(100, 119) AS i CREATE ({id: i})
$$) AS (v agtype);
 v 
---
(0 rows)

SELECT * FROM cypher('rewrite_inval', $$
    MATCH (n) WHERE n.id >= 100 AND n.id < 110 DETACH DELETE n
$$) AS (v agtype);
 v 
---
(0 rows)

SELECT * FROM cypher('rewrite_inval', $$
    MATCH p = (n0)-[:R*..2]->(n1) RETURN p
$$) AS (p agtype);
                                                                                                                                                       p                                                                                                                                                       
---------------------------------------------------------------------------------------------------------------------------------------------------------------------------------------------------------------------------------------------------------------------------------------------------------------
 [{"id": 281474976710715, "label": "_ag_label_vertex", "properties": {"id": 59}}::vertex, {"id": 844424930131969, "label": "R", "end_id": 281474976710716, "start_id": 281474976710715, "properties": {}}::edge, {"id": 281474976710716, "label": "_ag_label_vertex", "properties": {"id": 60}}::vertex]::path
(1 row)

VACUUM FULL rewrite_inval."_ag_label_vertex";
VACUUM FULL rewrite_inval."R";
SELECT * FROM cypher('rewrite_inval', $$
    MATCH p = (n0)-[:R*..2]->(n1) RETURN p
$$) AS (p agtype);
                                                                                                                                                       p                                                                                                                                                       
---------------------------------------------------------------------------------------------------------------------------------------------------------------------------------------------------------------------------------------------------------------------------------------------------------------
 [{"id": 281474976710715, "label": "_ag_label_vertex", "properties": {"id": 59}}::vertex, {"id": 844424930131969, "label": "R", "end_id": 281474976710716, "start_id": 281474976710715, "properties": {}}::edge, {"id": 281474976710716, "label": "_ag_label_vertex", "properties": {"id": 60}}::vertex]::path
(1 row)

-- plain VACUUM and ANALYZE leave tuples in place, so they are not rewrites and
-- the cached context stays usable
VACUUM rewrite_inval."_ag_label_vertex";
ANALYZE rewrite_inval."_ag_label_vertex";
SELECT * FROM cypher('rewrite_inval', $$
    MATCH p = (n0)-[:R*..2]->(n1) RETURN p
$$) AS (p agtype);
                                                                                                                                                       p                                                                                                                                                       
---------------------------------------------------------------------------------------------------------------------------------------------------------------------------------------------------------------------------------------------------------------------------------------------------------------
 [{"id": 281474976710715, "label": "_ag_label_vertex", "properties": {"id": 59}}::vertex, {"id": 844424930131969, "label": "R", "end_id": 281474976710716, "start_id": 281474976710715, "properties": {}}::edge, {"id": 281474976710716, "label": "_ag_label_vertex", "properties": {"id": 60}}::vertex]::path
(1 row)

-- the parenthesised spelling is a rewrite too
VACUUM (FULL) rewrite_inval."_ag_label_vertex";
SELECT * FROM cypher('rewrite_inval', $$
    MATCH p = (n0)-[:R*..2]->(n1) RETURN p
$$) AS (p agtype);
                                                                                                                                                       p                                                                                                                                                       
---------------------------------------------------------------------------------------------------------------------------------------------------------------------------------------------------------------------------------------------------------------------------------------------------------------
 [{"id": 281474976710715, "label": "_ag_label_vertex", "properties": {"id": 59}}::vertex, {"id": 844424930131969, "label": "R", "end_id": 281474976710716, "start_id": 281474976710715, "properties": {}}::edge, {"id": 281474976710716, "label": "_ag_label_vertex", "properties": {"id": 60}}::vertex]::path
(1 row)

-- and FULL turned off explicitly is not
VACUUM (FULL false) rewrite_inval."_ag_label_vertex";
SELECT * FROM cypher('rewrite_inval', $$
    MATCH p = (n0)-[:R*..2]->(n1) RETURN p
$$) AS (p agtype);
                                                                                                                                                       p                                                                                                                                                       
---------------------------------------------------------------------------------------------------------------------------------------------------------------------------------------------------------------------------------------------------------------------------------------------------------------
 [{"id": 281474976710715, "label": "_ag_label_vertex", "properties": {"id": 59}}::vertex, {"id": 844424930131969, "label": "R", "end_id": 281474976710716, "start_id": 281474976710715, "properties": {}}::edge, {"id": 281474976710716, "label": "_ag_label_vertex", "properties": {"id": 60}}::vertex]::path
(1 row)

-- naming no relation rewrites the whole database, which has to invalidate
-- every tracked graph rather than a named one
VACUUM FULL;
SELECT * FROM cypher('rewrite_inval', $$
    MATCH p = (n0)-[:R*..2]->(n1) RETURN p
$$) AS (p agtype);
                                                                                                                                                       p                                                                                                                                                       
---------------------------------------------------------------------------------------------------------------------------------------------------------------------------------------------------------------------------------------------------------------------------------------------------------------
 [{"id": 281474976710715, "label": "_ag_label_vertex", "properties": {"id": 59}}::vertex, {"id": 844424930131969, "label": "R", "end_id": 281474976710716, "start_id": 281474976710715, "properties": {}}::edge, {"id": 281474976710716, "label": "_ag_label_vertex", "properties": {"id": 60}}::vertex]::path
(1 row)

SELECT drop_graph('rewrite_inval', true);
NOTICE:  drop cascades to 3 other objects
DETAIL:  drop cascades to table rewrite_inval._ag_label_vertex
drop cascades to table rewrite_inval._ag_label_edge
drop cascades to table rewrite_inval."R"
NOTICE:  graph "rewrite_inval" has been dropped
 drop_graph 
------------
 
(1 row)

-----------------------------------------------------------------------------------------------------------------------------
--
-- NULL properties are a schema problem, not a stale cache
--
-- Label tables are created with properties NOT NULL, so a NULL there means the
-- table was altered out from under AGE. Reporting that as a stale TID sends the
-- reader after the wrong thing.
--
-----------------------------------------------------------------------------------------------------------------------------
SELECT create_graph('null_props');
NOTICE:  graph "null_props" has been created
 create_graph 
--------------
 
(1 row)

SELECT * FROM cypher('null_props', $$
    CREATE ({id: 1})-[:R {w: 1}]->({id: 2})
$$) AS (v agtype);
 v 
---
(0 rows)

ALTER TABLE null_props."_ag_label_vertex"
    ALTER COLUMN properties DROP NOT NULL;
UPDATE null_props."_ag_label_vertex" SET properties = NULL;
SELECT * FROM cypher('null_props', $$
    MATCH p = (n0)-[:R*..2]->(n1) RETURN p
$$) AS (p agtype);
ERROR:  get_vertex_entry_properties: vertex 281474976710657 has null properties
UPDATE null_props."_ag_label_vertex"
    SET properties = ag_catalog.agtype_build_map();
-- the edge constraint is inherited from _ag_label_edge, so it is dropped there
ALTER TABLE null_props."_ag_label_edge"
    ALTER COLUMN properties DROP NOT NULL;
UPDATE null_props."R" SET properties = NULL;
SELECT * FROM cypher('null_props', $$
    MATCH p = (n0)-[:R*..2]->(n1) RETURN p
$$) AS (p agtype);
ERROR:  get_edge_entry_properties: edge 844424930131969 has null properties
-- restored: projection works again
UPDATE null_props."R" SET properties = ag_catalog.agtype_build_map();
SELECT * FROM cypher('null_props', $$
    MATCH p = (n0)-[:R*..2]->(n1) RETURN p
$$) AS (p agtype);
                                                                                                                                               p                                                                                                                                               
-----------------------------------------------------------------------------------------------------------------------------------------------------------------------------------------------------------------------------------------------------------------------------------------------
 [{"id": 281474976710657, "label": "_ag_label_vertex", "properties": {}}::vertex, {"id": 844424930131969, "label": "R", "end_id": 281474976710658, "start_id": 281474976710657, "properties": {}}::edge, {"id": 281474976710658, "label": "_ag_label_vertex", "properties": {}}::vertex]::path
(1 row)

SELECT drop_graph('null_props', true);
NOTICE:  drop cascades to 3 other objects
DETAIL:  drop cascades to table null_props._ag_label_vertex
drop cascades to table null_props._ag_label_edge
drop cascades to table null_props."R"
NOTICE:  graph "null_props" has been dropped
 drop_graph 
------------
 
(1 row)

-----------------------------------------------------------------------------------------------------------------------------
--
-- A dropped graph releases its version counter slot
--
-- The counter table is a fixed size. While slots were never released it was a
-- tally of every graph ever mutated, so a server that cycles graphs filled it,
-- warned on every later mutation, and fell back to snapshot invalidation --
-- correct, but far more eager. Cycling well past the cap must now be silent.
--
-- NOTICEs are muted so the loop does not bury the output; a WARNING from a full
-- table would still come through and fail this test, which is the assertion.
--
-----------------------------------------------------------------------------------------------------------------------------
SET client_min_messages = warning;
DO $slots$
DECLARE
    i int;
BEGIN
    FOR i IN 1..260 LOOP
        PERFORM ag_catalog.create_graph('slot_churn_' || i);
        EXECUTE format('SELECT * FROM ag_catalog.cypher(%L, $c$ CREATE ({id: 1}) $c$) AS (v ag_catalog.agtype)',
                       'slot_churn_' || i);
        PERFORM ag_catalog.drop_graph('slot_churn_' || i, true);
    END LOOP;
END
$slots$;
RESET client_min_messages;
SELECT count(*) AS churn_graphs_left
FROM ag_catalog.ag_graph WHERE name::text LIKE 'slot_churn_%';
 churn_graphs_left 
-------------------
                 0
(1 row)

-- a drop that is rolled back must leave the graph tracked and usable
SELECT create_graph('drop_rollback');
NOTICE:  graph "drop_rollback" has been created
 create_graph 
--------------
 
(1 row)

SELECT * FROM cypher('drop_rollback', $$
    CREATE ({id: 1})-[:R]->({id: 2})
$$) AS (v agtype);
 v 
---
(0 rows)

SELECT * FROM cypher('drop_rollback', $$
    MATCH p = (n0)-[:R*..2]->(n1) RETURN p
$$) AS (p agtype);
                                                                                                                                                      p                                                                                                                                                      
-------------------------------------------------------------------------------------------------------------------------------------------------------------------------------------------------------------------------------------------------------------------------------------------------------------
 [{"id": 281474976710657, "label": "_ag_label_vertex", "properties": {"id": 1}}::vertex, {"id": 844424930131969, "label": "R", "end_id": 281474976710658, "start_id": 281474976710657, "properties": {}}::edge, {"id": 281474976710658, "label": "_ag_label_vertex", "properties": {"id": 2}}::vertex]::path
(1 row)

BEGIN;
SELECT drop_graph('drop_rollback', true);
NOTICE:  drop cascades to 3 other objects
DETAIL:  drop cascades to table drop_rollback._ag_label_vertex
drop cascades to table drop_rollback._ag_label_edge
drop cascades to table drop_rollback."R"
NOTICE:  graph "drop_rollback" has been dropped
 drop_graph 
------------
 
(1 row)

ROLLBACK;
SELECT * FROM cypher('drop_rollback', $$
    MATCH p = (n0)-[:R*..2]->(n1) RETURN p
$$) AS (p agtype);
                                                                                                                                                      p                                                                                                                                                      
-------------------------------------------------------------------------------------------------------------------------------------------------------------------------------------------------------------------------------------------------------------------------------------------------------------
 [{"id": 281474976710657, "label": "_ag_label_vertex", "properties": {"id": 1}}::vertex, {"id": 844424930131969, "label": "R", "end_id": 281474976710658, "start_id": 281474976710657, "properties": {}}::edge, {"id": 281474976710658, "label": "_ag_label_vertex", "properties": {"id": 2}}::vertex]::path
(1 row)

-- and a later mutation still invalidates correctly
SELECT * FROM cypher('drop_rollback', $$ CREATE ({id: 3}) $$) AS (v agtype);
 v 
---
(0 rows)

SELECT * FROM cypher('drop_rollback', $$
    MATCH p = (n0)-[:R*..2]->(n1) RETURN p
$$) AS (p agtype);
                                                                                                                                                      p                                                                                                                                                      
-------------------------------------------------------------------------------------------------------------------------------------------------------------------------------------------------------------------------------------------------------------------------------------------------------------
 [{"id": 281474976710657, "label": "_ag_label_vertex", "properties": {"id": 1}}::vertex, {"id": 844424930131969, "label": "R", "end_id": 281474976710658, "start_id": 281474976710657, "properties": {}}::edge, {"id": 281474976710658, "label": "_ag_label_vertex", "properties": {"id": 2}}::vertex]::path
(1 row)

SELECT drop_graph('drop_rollback', true);
NOTICE:  drop cascades to 3 other objects
DETAIL:  drop cascades to table drop_rollback._ag_label_vertex
drop cascades to table drop_rollback._ag_label_edge
drop cascades to table drop_rollback."R"
NOTICE:  graph "drop_rollback" has been dropped
 drop_graph 
------------
 
(1 row)

-- a graph recreated under the same name must not inherit the old one's
-- context. The freed slot may be handed straight back, so the new occupant's
-- version has to be distinguishable from whatever was cached for the previous
-- one.
SELECT create_graph('slot_reuse');
NOTICE:  graph "slot_reuse" has been created
 create_graph 
--------------
 
(1 row)

SELECT * FROM cypher('slot_reuse', $$
    CREATE ({id: 111})-[:R]->({id: 222})
$$) AS (v agtype);
 v 
---
(0 rows)

SELECT * FROM cypher('slot_reuse', $$
    MATCH p = (a)-[:R*..2]->(b) RETURN p
$$) AS (p agtype);
                                                                                                                                                        p                                                                                                                                                        
-----------------------------------------------------------------------------------------------------------------------------------------------------------------------------------------------------------------------------------------------------------------------------------------------------------------
 [{"id": 281474976710657, "label": "_ag_label_vertex", "properties": {"id": 111}}::vertex, {"id": 844424930131969, "label": "R", "end_id": 281474976710658, "start_id": 281474976710657, "properties": {}}::edge, {"id": 281474976710658, "label": "_ag_label_vertex", "properties": {"id": 222}}::vertex]::path
(1 row)

SELECT drop_graph('slot_reuse', true);
NOTICE:  drop cascades to 3 other objects
DETAIL:  drop cascades to table slot_reuse._ag_label_vertex
drop cascades to table slot_reuse._ag_label_edge
drop cascades to table slot_reuse."R"
NOTICE:  graph "slot_reuse" has been dropped
 drop_graph 
------------
 
(1 row)

SELECT create_graph('slot_reuse');
NOTICE:  graph "slot_reuse" has been created
 create_graph 
--------------
 
(1 row)

SELECT * FROM cypher('slot_reuse', $$
    CREATE ({id: 333})-[:R]->({id: 444})
$$) AS (v agtype);
 v 
---
(0 rows)

-- 333 -> 444, never the dropped graph's 111 -> 222
SELECT * FROM cypher('slot_reuse', $$
    MATCH p = (a)-[:R*..2]->(b) RETURN p
$$) AS (p agtype);
                                                                                                                                                        p                                                                                                                                                        
-----------------------------------------------------------------------------------------------------------------------------------------------------------------------------------------------------------------------------------------------------------------------------------------------------------------
 [{"id": 281474976710657, "label": "_ag_label_vertex", "properties": {"id": 333}}::vertex, {"id": 844424930131969, "label": "R", "end_id": 281474976710658, "start_id": 281474976710657, "properties": {}}::edge, {"id": 281474976710658, "label": "_ag_label_vertex", "properties": {"id": 444}}::vertex]::path
(1 row)

SELECT drop_graph('slot_reuse', true);
NOTICE:  drop cascades to 3 other objects
DETAIL:  drop cascades to table slot_reuse._ag_label_vertex
drop cascades to table slot_reuse._ag_label_edge
drop cascades to table slot_reuse."R"
NOTICE:  graph "slot_reuse" has been dropped
 drop_graph 
------------
 
(1 row)

-----------------------------------------------------------------------------------------------------------------------------
--
-- End of tests
--
